87,Great House Archaeological Site,-71.061449,42.37188,,,City Square,Charlestown,MA,,,Building,,,,,,,,http://bit.ly/1jol0tL
88,Lewis Dawson Farm House,-71.124123,42.303352,,1090,Centre Street,Jamaica Plain,MA,,,Building,,,,,,,,
89,41 Princeton Street,-71.037397,42.376863,,41,Princeton Street (Architectural Conservation District),Boston,MA,,,Building,,,,,,,,http://bit.ly/1g1X4Ml
90,Sidewalk Clock - Peabody Square,-71.064123,42.28595,,,Peabody Square at the intersection of Dorchester Avenue and Ashmont Street,Dorchester,MA,,,Building,,,,,,,,
91,Sidewalk Clock - 342 West Broadway,-71.049719,42.338302,,342,West Broadway,South End,MA,,,Building,,,,,,,,
92,Sidewalk Clock - 333 Massachusetts Ave,-71.084724,42.342388,,333,Massachusetts Avenue,South End,MA,,,Building,,,,,,,,
93,Christian Science Center Complex,-71.084306,42.344577,,,"Bounded by Huntington Avenue, Horticultural Hall, Massachusetts Avenue, Clearway Street, Dalton Street, and Belvidere Street",Fenway,MA,,3/9/11,Building,,,,,,,,
94,Elizabeth Peabody Bookstore and Circulating Library,-71.062141,42.354677,,13-15,West Street,Boston,MA,,11/23/11,Building,,,,,,,,http://bit.ly/1lGnbcZ
96,St. Gabriel's Monastery Building,-71.146295,42.347324,,159,Washington Street,Brighton,MA,,1/10/89,Building,,,,,,,,http://bit.ly/1kDArNW
97,Fowler Clark Farm,-71.088935,42.279966,,487,Norfolk Street,Mattapan,MA,,1/10/06,Building,,,,,,,,
99,20-30 Bromfield Street,-71.060071,42.356605,,20-30,Bromfield Street,Boston,MA,,3/8/83,Building,,,,,,,,